{
  "buildId": "b-aaaaaaaaaaaaaaaaaaaaaaaaaaaaaaaaaaaaaaaaaaaaaaaaaaaaaaaaaaaaaaaa",
  "sdkVersion": "2024.0",
  "toolchainFingerprint": "9f1e6240b623cfc1e7303ea8d4960d5014877722575750b6ed4598a2a0c1b099",
  "manifestVersion": 1,
  "profile": "javadoc-lexical",
  "inputDigest": "aaaaaaaaaaaaaaaaaaaaaaaaaaaaaaaaaaaaaaaaaaaaaaaaaaaaaaaaaaaaaaaa",
  "recipeDigest": "f629ca6a8675873cffc95d3178b6c4005c26cf8e3148247329d2864817a94519",
  "runtimeDigest": "9f1e6240b623cfc1e7303ea8d4960d5014877722575750b6ed4598a2a0c1b099",
  "capabilities": [
    "api-documentation",
    "catalog",
    "narrative-documentation",
    "relationships",
    "structured-documentation"
  ],
  "capabilityFingerprint": "01c8fc8f142baa0af2922b38413e6fe2bbb205f29af8f5ff229d19860d14a0bc"
}
